number,value,datetime_start,datetime_complete,duration,params_batch,params_bidir,params_class_weight,params_criterio,params_dropout,params_escalador,params_filtros_base,params_focal_gamma,params_grad_clip,params_hidden,params_kernel,params_label_smooth,params_layers,params_lookback,params_loss,params_lr,params_pooling,params_scheduler,params_weight_decay,state
0,0.30915031868256293,2026-08-14 23:06:40.863285,2026-08-14 23:07:29.147327,0 days 00:00:48.284042,128,True,sqrt,val_f1,0.519705687464961,robust,30,1.9810364221551062,0.5,18,5,,2,10,focal,0.0003083434817935577,meanmax,plateau,0.0034702669886504172,COMPLETE
1,0.31902317743732683,2026-08-14 23:07:29.154786,2026-08-14 23:11:22.058092,0 days 00:03:52.903306,64,True,none,val_f1,0.3120408127066865,robust,79,0.686376609199427,5.0,247,5,,3,10,focal,0.0002260828676373493,last,none,8.399864445957506e-06,COMPLETE
2,0.2824705816160451,2026-08-14 23:11:22.066537,2026-08-14 23:11:36.534617,0 days 00:00:14.468080,256,False,balanced,val_loss,0.38253448281312785,standard,85,1.0719954137290562,1.0,19,5,,1,60,focal,0.0015766436357943082,attn,plateau,0.00022965432344634358,COMPLETE
3,0.2546765819878528,2026-08-14 23:11:36.542693,2026-08-14 23:12:25.218012,0 days 00:00:48.675319,64,True,balanced,val_f1,0.516438349953806,minmax,64,,0.5,34,3,0.01029575024999787,3,60,ce,1.0404501336028154e-05,meanmax,none,0.00035787924535023234,COMPLETE
4,0.30868062548631253,2026-08-14 23:12:25.224832,2026-08-14 23:12:59.294005,0 days 00:00:34.069173,64,False,sqrt,val_f1_ma3,0.11191110623991253,minmax,72,,5.0,31,3,0.10593011567120131,1,40,ce,1.2618419742822217e-05,last,cosine,0.0009004606022643075,COMPLETE
5,0.26755521978871966,2026-08-14 23:12:59.300930,2026-08-14 23:13:28.452812,0 days 00:00:29.151882,128,False,balanced,val_loss,0.3981010614648335,minmax,28,,0.5,91,5,0.17840931103542268,3,10,ce,1.0292909562864094e-05,attn,none,6.368545516399497e-06,COMPLETE
6,0.33265705021766623,2026-08-14 23:13:28.460848,2026-08-14 23:13:46.315458,0 days 00:00:17.854610,256,False,sqrt,val_f1,0.5799928914262017,standard,84,1.398727878049388,1.0,35,7,,3,40,focal,0.002437830614871069,last,plateau,0.01840972398983907,COMPLETE
7,0.3379053542373893,2026-08-14 23:13:46.323624,2026-08-14 23:14:19.603951,0 days 00:00:33.280327,256,True,sqrt,val_loss,0.32558678082454595,robust,37,,5.0,33,7,0.15903723895374075,2,20,ce,5.126222187253491e-05,last,cosine,0.0008998420889037459,COMPLETE
8,0.31536615921032873,2026-08-14 23:14:19.610474,2026-08-14 23:15:01.985654,0 days 00:00:42.375180,128,True,sqrt,val_f1,0.36703244774061133,robust,16,,0.5,90,5,0.07492252292529425,2,20,ce,0.00010949649892243712,attn,plateau,1.7324270154949117e-05,COMPLETE
9,0.2926413646707707,2026-08-14 23:15:01.993382,2026-08-14 23:16:36.974828,0 days 00:01:34.981446,512,True,sqrt,val_f1,0.5432103851736382,minmax,95,,1.0,149,7,0.1501229503281717,3,60,ce,3.0549097281632174e-05,attn,cosine,2.2223195374893766e-06,COMPLETE
10,0.2660613524785495,2026-08-14 23:16:36.982384,2026-08-14 23:16:53.416149,0 days 00:00:16.433765,256,True,balanced,val_f1,0.006502590888179016,robust,18,1.3772875313801967,0.5,22,3,,1,40,focal,0.0017488031925099968,attn,none,2.860443565915635e-06,COMPLETE
11,0.2347314126716667,2026-08-14 23:16:53.423109,2026-08-14 23:17:14.743257,0 days 00:00:21.320148,512,True,none,val_f1,0.452026911155365,standard,18,1.0589895962986315,5.0,231,5,,1,60,focal,8.551466852013352e-05,attn,plateau,2.615192026778637e-06,COMPLETE
12,0.32595503609832177,2026-08-14 23:17:14.750660,2026-08-14 23:18:02.057335,0 days 00:00:47.306675,128,False,sqrt,val_f1,0.16857791375533818,minmax,34,,0.5,119,5,0.18995998265838482,2,40,ce,0.0022609163158429113,last,none,0.02826955156816132,COMPLETE
13,0.33583526005210085,2026-08-14 23:18:02.064795,2026-08-14 23:18:31.514440,0 days 00:00:29.449645,128,True,none,val_f1_ma3,0.16404424315842372,minmax,21,1.8007692522594834,0.5,135,5,,2,10,focal,1.37926889120243e-05,meanmax,cosine,0.02106744560525704,COMPLETE
14,0.3042177673900252,2026-08-14 23:18:31.521473,2026-08-14 23:18:51.487843,0 days 00:00:19.966370,128,True,none,val_loss,0.2624849532142374,standard,64,0.820114597394431,1.0,24,5,,1,40,focal,0.0017366436783471763,meanmax,plateau,5.511595477601768e-05,COMPLETE
15,0.34050474392478836,2026-08-14 23:18:51.494176,2026-08-14 23:19:48.404447,0 days 00:00:56.910271,128,True,none,val_f1,0.21856191662884528,standard,48,0.5917080072264947,5.0,31,7,,3,40,focal,0.00017661420128873266,last,cosine,0.0028312234265202266,COMPLETE
16,0.3345134042879777,2026-08-14 23:19:48.425450,2026-08-14 23:20:19.147056,0 days 00:00:30.721606,512,True,balanced,val_f1,0.40746139148669375,minmax,20,,1.0,34,5,0.03731340481026115,1,40,ce,0.0009013072173715609,attn,cosine,0.00031060682524644936,COMPLETE
17,0.28372010304030143,2026-08-14 23:20:19.155544,2026-08-14 23:20:37.039465,0 days 00:00:17.883921,256,True,none,val_loss,0.1679874561961705,robust,90,1.1366016369094096,0.5,105,3,,3,20,focal,0.0008056145478991701,attn,plateau,8.614275214800757e-06,COMPLETE
18,0.2637697100008491,2026-08-14 23:20:37.047738,2026-08-14 23:20:43.000261,0 days 00:00:05.952523,128,True,none,val_loss,0.4771603871159341,robust,58,2.7661802774113675,5.0,89,5,,1,40,focal,3.1583141060896896e-05,attn,plateau,6.580815488709269e-06,PRUNED
19,0.25053585299013187,2026-08-14 23:20:43.008364,2026-08-14 23:21:45.484311,0 days 00:01:02.475947,128,True,balanced,val_f1,0.5260593820570496,robust,111,,0.5,221,7,0.09240116072882654,1,60,ce,7.036844767189019e-05,attn,plateau,0.012772812100441663,COMPLETE
20,0.2617941908951696,2026-08-14 23:21:45.492267,2026-08-14 23:21:56.224883,0 days 00:00:10.732616,64,True,balanced,val_loss,0.5553411077440658,robust,107,2.343753120274371,0.5,55,7,,1,60,focal,0.000130853031766526,meanmax,plateau,3.6829025642112775e-06,PRUNED
21,0.34020526849314314,2026-08-14 23:21:56.231719,2026-08-14 23:22:05.851358,0 days 00:00:09.619639,512,False,balanced,val_f1,0.5981245511075683,robust,70,2.6544640525337933,0.5,221,3,,2,10,focal,0.00017538721588318982,last,cosine,0.0009482548804624966,COMPLETE
22,0.32574798950510997,2026-08-14 23:22:05.859410,2026-08-14 23:22:28.572071,0 days 00:00:22.712661,128,False,balanced,val_f1,0.14290966862803592,robust,29,,0.5,45,3,0.0518846866862585,2,20,ce,1.7633088515138756e-05,meanmax,plateau,1.643845340580847e-05,COMPLETE
23,0.34486370604176164,2026-08-14 23:22:28.580719,2026-08-14 23:22:57.292388,0 days 00:00:28.711669,256,True,none,val_f1_ma3,0.3249805287965201,minmax,46,2.684725193906288,5.0,83,7,,2,10,focal,0.0003708534834594607,last,plateau,1.9473249450858307e-05,COMPLETE
24,0.3222380905717864,2026-08-14 23:22:57.301501,2026-08-14 23:27:57.284247,0 days 00:04:59.982746,128,True,sqrt,val_f1,0.17827302937390502,standard,108,,1.0,154,5,0.049280406647821365,3,60,ce,0.00025296065274446107,last,none,0.00024002253099641174,COMPLETE
25,0.3198939922813685,2026-08-14 23:27:57.292406,2026-08-14 23:29:05.981957,0 days 00:01:08.689551,128,True,none,val_f1,0.26460154719524637,standard,54,2.9921239675644533,5.0,59,7,,3,40,focal,0.0003827084122025297,last,cosine,0.0023060124704315406,COMPLETE
26,0.32413573999275136,2026-08-14 23:29:05.993630,2026-08-14 23:29:50.518137,0 days 00:00:44.524507,256,True,none,val_f1_ma3,0.29961653401483535,minmax,25,2.511632559777629,5.0,41,7,,2,10,focal,0.000997574383849028,last,cosine,1.4074724254906945e-05,COMPLETE
27,0.35419349742307804,2026-08-14 23:29:50.527358,2026-08-14 23:30:17.985315,0 days 00:00:27.457957,128,False,balanced,val_loss,0.5327486105002439,robust,101,2.5021819454878593,0.5,199,3,,1,10,focal,0.0005297283176564238,last,cosine,0.0037024604061812036,COMPLETE
28,0.3047270539645308,2026-08-14 23:30:17.993938,2026-08-14 23:30:43.910867,0 days 00:00:25.916929,128,False,balanced,val_loss,0.4059633237152082,minmax,93,,0.5,130,7,0.12590807577702381,1,10,ce,0.0009109976191540773,last,cosine,0.00027314699324499254,COMPLETE
29,0.33915265688475965,2026-08-14 23:30:43.920440,2026-08-14 23:31:21.512120,0 days 00:00:37.591680,128,False,balanced,val_f1_ma3,0.5120609779197285,standard,117,0.5519943416107445,0.5,132,3,,2,10,focal,0.001014285704531009,last,none,0.0008278018937239046,COMPLETE
30,0.353338110395892,2026-08-14 23:31:21.519535,2026-08-14 23:32:06.844263,0 days 00:00:45.324728,128,False,balanced,val_loss,0.523991384625342,robust,101,2.159236682347041,0.5,249,3,,1,60,focal,0.00070848088056392,last,cosine,0.0027139951513394534,COMPLETE
31,0.34410562002718864,2026-08-14 23:32:06.853072,2026-08-14 23:32:34.938589,0 days 00:00:28.085517,128,False,balanced,val_loss,0.4962048239399205,robust,110,2.198005058676373,0.5,118,3,,1,60,focal,0.002820418649890106,last,cosine,0.0031349416693915236,COMPLETE
32,0.25398097300569333,2026-08-14 23:32:34.947940,2026-08-14 23:33:25.398232,0 days 00:00:50.450292,128,False,balanced,val_loss,0.4298877574965585,robust,105,2.187341253746957,0.5,238,3,,1,60,focal,0.000780144367286029,meanmax,plateau,0.027275873251756136,COMPLETE
33,0.31972070989235113,2026-08-14 23:33:25.407267,2026-08-14 23:33:49.040745,0 days 00:00:23.633478,128,False,balanced,val_loss,0.48787145843725305,minmax,66,2.2047247535689793,5.0,101,3,,1,60,focal,0.002777653354114367,last,cosine,0.023666210012234186,COMPLETE
34,0.3339701777565463,2026-08-14 23:33:49.050370,2026-08-14 23:34:59.722127,0 days 00:01:10.671757,128,False,sqrt,val_loss,0.4937918092273339,robust,107,2.3456173943644765,1.0,249,5,,2,60,focal,0.0004625248396097191,last,cosine,0.00031122424266688184,COMPLETE
35,0.3209447324642679,2026-08-14 23:34:59.733135,2026-08-14 23:35:22.668146,0 days 00:00:22.935011,512,False,sqrt,val_loss,0.5050646761475978,robust,104,,0.5,202,3,0.003662439618102281,1,60,ce,0.0020987798507867664,last,cosine,0.004378969586474522,COMPLETE
36,0.31042791361900623,2026-08-14 23:35:22.678250,2026-08-14 23:35:46.553935,0 days 00:00:23.875685,128,True,balanced,val_loss,0.5642545059701372,robust,58,2.445178074627031,0.5,122,3,,1,20,focal,0.0021903744999686894,attn,cosine,0.0011783191463012157,COMPLETE
37,0.3255047321063707,2026-08-14 23:35:46.560765,2026-08-14 23:36:33.845807,0 days 00:00:47.285042,64,False,balanced,val_loss,0.47693919880991464,robust,105,2.003505856049792,0.5,155,3,,1,40,focal,0.0007344967403644516,last,cosine,0.000740588328402383,COMPLETE
38,0.2958956218590729,2026-08-14 23:36:33.855100,2026-08-14 23:40:21.103286,0 days 00:03:47.248186,128,False,balanced,val_f1_ma3,0.43662589504579136,robust,67,2.692325744939535,0.5,164,3,,2,60,focal,0.001346615908781994,last,cosine,0.00218149208765359,COMPLETE
39,0.3151291199456337,2026-08-14 23:40:21.112540,2026-08-14 23:40:32.655928,0 days 00:00:11.543388,256,True,none,val_f1_ma3,0.3193319893763529,standard,61,2.1640943198012383,5.0,47,7,,2,20,focal,0.000376218459296726,last,plateau,9.67961836237896e-06,PRUNED
40,0.3324748240140092,2026-08-14 23:40:32.666334,2026-08-14 23:40:53.252171,0 days 00:00:20.585837,256,False,balanced,val_f1_ma3,0.21970515551251474,minmax,28,2.573015567579225,5.0,95,7,,3,10,focal,0.00013637717316307698,last,plateau,9.298076717450998e-05,COMPLETE
41,0.2713028092326317,2026-08-14 23:40:53.260401,2026-08-14 23:40:55.934941,0 days 00:00:02.674540,512,True,none,val_f1_ma3,0.3220469812296866,minmax,54,,5.0,119,7,0.11854678125960791,2,10,ce,0.00010808993799908711,last,none,5.571106281745816e-06,PRUNED
42,0.34965798912948587,2026-08-14 23:40:55.942989,2026-08-14 23:41:19.623335,0 days 00:00:23.680346,128,False,balanced,val_loss,0.4373147299005612,robust,93,0.6262601684884413,5.0,159,3,,1,10,focal,0.0006401144398078076,last,none,0.0030900422359649757,COMPLETE
43,0.3230918321932902,2026-08-14 23:41:19.632100,2026-08-14 23:41:45.133305,0 days 00:00:25.501205,128,True,none,val_loss,0.3379715124173508,robust,106,2.277391051150137,1.0,142,3,,1,10,focal,0.0009114153604910635,last,none,0.022696911023890768,COMPLETE
44,0.2670763883151485,2026-08-14 23:41:45.142959,2026-08-14 23:41:49.184796,0 days 00:00:04.041837,256,True,none,val_f1_ma3,0.4113673291078377,minmax,52,2.4743652034745294,5.0,142,7,,2,10,focal,8.476705357447816e-05,last,plateau,1.9836899333181603e-05,PRUNED
45,0.32580467836191174,2026-08-14 23:41:49.191223,2026-08-14 23:42:05.828358,0 days 00:00:16.637135,128,False,none,val_f1,0.49450311651159135,standard,113,1.8183113616124393,0.5,109,3,,1,60,focal,0.0018254594110738737,last,cosine,0.02086657933301146,PRUNED
46,0.3620507875878193,2026-08-14 23:42:05.835105,2026-08-14 23:42:32.197029,0 days 00:00:26.361924,128,False,balanced,val_loss,0.42249595653190186,robust,77,2.007025567677695,5.0,136,7,,1,20,focal,0.0004397620359576416,last,none,0.018214698953737334,COMPLETE
47,0.334448110141334,2026-08-14 23:42:32.206379,2026-08-14 23:42:55.077766,0 days 00:00:22.871387,128,False,balanced,val_loss,0.4089000155198803,robust,51,1.8338425683483668,5.0,171,3,,1,10,focal,0.0006245504033236193,attn,none,0.0020628783321167497,COMPLETE
48,0.32543117160638246,2026-08-14 23:42:55.085825,2026-08-14 23:43:17.986366,0 days 00:00:22.900541,128,False,sqrt,val_loss,0.5152290258576797,robust,76,0.6190812299627354,5.0,50,7,,1,20,focal,0.001553162693378519,last,none,0.00024032182437079395,COMPLETE
49,0.3541421131325889,2026-08-14 23:43:17.995036,2026-08-14 23:43:46.896187,0 days 00:00:28.901151,128,False,balanced,val_loss,0.24881857656012632,robust,122,2.9440451348185124,5.0,134,7,,2,20,focal,0.00016377735724675357,last,none,0.0016366470698885212,COMPLETE
50,0.3563382599459086,2026-08-14 23:43:46.904448,2026-08-14 23:44:08.366589,0 days 00:00:21.462141,128,False,balanced,val_loss,0.1461314001525303,robust,100,2.883648112414274,1.0,98,7,,2,20,focal,6.04070676302751e-05,last,none,0.017155567869205912,COMPLETE
51,0.3550954425544573,2026-08-14 23:44:08.374279,2026-08-14 23:44:27.233848,0 days 00:00:18.859569,128,False,balanced,val_loss,0.10501707640825121,robust,107,2.944634739411491,1.0,61,7,,2,20,focal,5.406758031188077e-05,last,none,0.05279672725978376,COMPLETE
52,0.3057652326033368,2026-08-14 23:44:27.241069,2026-08-14 23:45:27.339184,0 days 00:01:00.098115,128,False,balanced,val_f1_ma3,0.2686584018389721,robust,99,2.9847134689208867,5.0,223,7,,3,20,focal,0.000375190581370011,last,none,0.003338658253087485,COMPLETE
53,0.32856831172057516,2026-08-14 23:45:27.346026,2026-08-14 23:45:55.935254,0 days 00:00:28.589228,128,False,balanced,val_loss,0.1266681834735639,robust,98,2.9837055055373387,1.0,55,7,,2,20,focal,1.6045746208206404e-05,last,none,0.021289096948345562,COMPLETE
54,0.3554853745944923,2026-08-14 23:45:55.943330,2026-08-14 23:46:38.693730,0 days 00:00:42.750400,128,True,balanced,val_loss,0.34443961408391066,standard,116,2.9983841837448044,5.0,143,7,,2,20,focal,0.00011349568420783111,last,none,0.022923399647389632,COMPLETE
55,0.3605895416096324,2026-08-14 23:46:38.703484,2026-08-14 23:47:33.770937,0 days 00:00:55.067453,64,True,balanced,val_loss,0.33733277110425897,standard,91,2.957629791676606,0.5,226,7,,1,20,focal,0.00011519614907144799,last,none,0.0023717121592617373,COMPLETE
56,0.3463234899676817,2026-08-14 23:47:33.777914,2026-08-14 23:48:29.158936,0 days 00:00:55.381022,64,True,balanced,val_loss,0.12255833276916756,standard,114,2.946466234365094,0.5,251,7,,1,20,focal,0.00016622205658629562,last,none,0.000794200191777012,COMPLETE
57,0.34263874947670525,2026-08-14 23:48:29.165423,2026-08-14 23:50:28.222563,0 days 00:01:59.057140,128,True,balanced,val_loss,0.21812293852418518,minmax,80,2.9853482492285184,5.0,205,7,,2,60,focal,3.130611924073232e-05,last,none,0.015029416347516244,COMPLETE
58,0.3474962378747577,2026-08-14 23:50:28.229357,2026-08-14 23:50:50.996234,0 days 00:00:22.766877,128,False,balanced,val_loss,0.3676139524225844,robust,35,2.970846214223656,1.0,100,5,,1,20,focal,0.00022438224758456005,last,none,0.0075712306525549744,COMPLETE
59,0.3436459337016493,2026-08-14 23:50:51.003541,2026-08-14 23:51:10.077026,0 days 00:00:19.073485,256,False,sqrt,val_loss,0.03352539614116336,robust,100,2.992192299477641,1.0,133,7,,2,20,focal,0.00013958067243826424,meanmax,none,0.024454194219134716,COMPLETE
60,0.3394830108767803,2026-08-14 23:51:10.084960,2026-08-14 23:51:44.486825,0 days 00:00:34.401865,128,True,balanced,val_loss,0.5685810750258455,standard,78,2.985928466129326,5.0,56,7,,2,20,focal,0.00031840209782100067,last,none,0.012605066161145468,COMPLETE
61,0.346911051938518,2026-08-14 23:51:44.495657,2026-08-14 23:52:55.396804,0 days 00:01:10.901147,128,True,balanced,val_loss,0.29776914200415905,standard,104,,5.0,200,7,0.19984764358511545,3,20,ce,7.565964839068981e-05,meanmax,none,0.009473755825703017,COMPLETE
62,0.3389082295670254,2026-08-14 23:52:55.404858,2026-08-14 23:53:03.667046,0 days 00:00:08.262188,512,False,balanced,val_loss,0.0677039897163386,standard,103,2.9817986692341605,0.5,60,5,,2,20,focal,0.00012778964911040847,last,none,0.09792897608399817,COMPLETE
63,0.3452582403659346,2026-08-14 23:53:03.674735,2026-08-14 23:53:17.227335,0 days 00:00:13.552600,256,False,balanced,val_loss,0.29771150595665247,robust,112,2.7687545720981817,5.0,144,7,,1,20,focal,0.00044751071928949556,last,none,0.043925312171247,COMPLETE
64,0.34365613507256176,2026-08-14 23:53:17.233625,2026-08-14 23:53:39.735372,0 days 00:00:22.501747,512,True,balanced,val_loss,0.3911707942633155,standard,102,2.979677623892675,5.0,154,5,,2,20,focal,0.00012980777826224785,attn,none,0.007749942841795914,COMPLETE
65,0.3216606417826539,2026-08-14 23:53:39.764287,2026-08-14 23:55:00.976309,0 days 00:01:21.212022,64,False,balanced,val_loss,0.2034290235848326,robust,83,2.708219619122628,1.0,152,7,,3,40,focal,0.0004404046909276832,last,none,0.060039794941426645,COMPLETE
66,0.3429804670291844,2026-08-14 23:55:00.982233,2026-08-14 23:55:30.883359,0 days 00:00:29.901126,128,False,balanced,val_loss,0.4165367254280058,minmax,80,2.6931863403564873,0.5,198,7,,1,20,focal,8.60706091995949e-05,last,none,0.0004526951720571942,COMPLETE
67,0.3414854350099207,2026-08-14 23:55:30.890334,2026-08-14 23:55:56.435124,0 days 00:00:25.544790,128,True,balanced,val_loss,0.19777795198648107,robust,75,2.992959774340925,1.0,110,7,,2,10,focal,0.00013408753282219873,attn,none,0.08689674147124368,COMPLETE
68,0.32797371501911776,2026-08-14 23:55:56.442826,2026-08-14 23:56:15.662832,0 days 00:00:19.220006,128,False,balanced,val_loss,0.522150680838666,robust,48,2.669624652102082,5.0,102,7,,1,20,focal,0.001433649352047321,meanmax,none,0.019543951749105427,COMPLETE
69,0.34687310619463496,2026-08-14 23:56:15.669859,2026-08-14 23:56:41.197666,0 days 00:00:25.527807,128,False,balanced,val_loss,0.2944496187814591,standard,87,2.996347861680973,5.0,97,7,,2,20,focal,7.721530038622205e-05,last,plateau,0.010736397056308048,COMPLETE
70,0.3566035366247542,2026-08-14 23:56:41.204987,2026-08-14 23:57:50.267429,0 days 00:01:09.062442,64,True,balanced,val_loss,0.5282668050525283,standard,103,2.6261312003201494,0.5,247,7,,1,20,focal,0.0004250082506825677,meanmax,none,0.00306354494981485,COMPLETE
71,0.33683890042122544,2026-08-14 23:57:50.274698,2026-08-14 23:59:03.865584,0 days 00:01:13.590886,64,True,sqrt,val_loss,0.4728927409826308,standard,99,2.576270815644836,0.5,230,7,,1,20,focal,0.0003628426535786819,meanmax,none,0.002093359370486771,COMPLETE
72,0.3474873818744185,2026-08-14 23:59:03.872731,2026-08-14 23:59:40.364267,0 days 00:00:36.491536,64,True,balanced,val_loss,0.4386959844656393,standard,62,2.621927438764737,0.5,75,3,,1,20,focal,0.00023690186976729272,last,none,0.057285814284762905,COMPLETE
73,0.3374596898433907,2026-08-14 23:59:40.370375,2026-08-15 00:00:09.068291,0 days 00:00:28.697916,128,False,balanced,val_loss,0.41774723650532763,robust,99,,5.0,95,7,0.07969063198588118,2,20,ce,3.898469366777499e-05,last,none,9.688422850651943e-05,COMPLETE
74,0.32891828014100544,2026-08-15 00:00:09.074693,2026-08-15 00:01:19.490579,0 days 00:01:10.415886,64,False,balanced,val_f1_ma3,0.2949303976485364,standard,100,2.6213044685545084,0.5,148,7,,1,20,focal,6.399845220482432e-05,last,cosine,0.010949679179717219,COMPLETE
75,0.33826383829792905,2026-08-15 00:01:19.497712,2026-08-15 00:01:57.161687,0 days 00:00:37.663975,64,False,balanced,val_loss,0.4506172411809529,standard,87,1.4641454325696892,1.0,161,7,,1,10,focal,0.00034152110634622015,meanmax,none,0.00024720344590975295,COMPLETE
76,0.31335214331238936,2026-08-15 00:01:57.168255,2026-08-15 00:02:21.091522,0 days 00:00:23.923267,128,False,balanced,val_loss,0.5918700246962277,minmax,125,2.623693391780418,0.5,209,3,,2,10,focal,0.0001502469575715914,last,cosine,0.01521161773612816,COMPLETE
77,0.35614009397520885,2026-08-15 00:02:21.098430,2026-08-15 00:03:14.883928,0 days 00:00:53.785498,64,True,balanced,val_loss,0.5612518156613523,minmax,91,,0.5,228,7,0.1297533741820603,1,10,ce,0.0006995673207825176,meanmax,none,0.0018136694459705471,COMPLETE
78,0.3187029621401952,2026-08-15 00:03:14.890862,2026-08-15 00:03:39.099553,0 days 00:00:24.208691,256,True,balanced,val_loss,0.47947700212815725,minmax,77,,0.5,226,7,0.1337564664509287,2,20,ce,0.0007539898293521184,meanmax,none,0.000559725903556965,COMPLETE
79,0.2979078410979366,2026-08-15 00:03:39.106837,2026-08-15 00:05:09.822249,0 days 00:01:30.715412,64,True,balanced,val_f1,0.5924182827472253,standard,90,2.509824225063377,0.5,171,5,,1,20,focal,0.0005930781475737317,meanmax,none,0.00010272192753689411,COMPLETE
