number,value,datetime_start,datetime_complete,duration,params_C,params_class_weight,params_escalador,params_l1_ratio,params_penalty,state
141,0.33363975946132957,2026-08-15 00:17:40.452456,2026-08-15 00:17:40.905919,0 days 00:00:00.453463,0.00012221544002931275,balanced,robust,,l2,COMPLETE
142,0.3327271018520185,2026-08-15 00:17:40.912938,2026-08-15 00:17:41.361510,0 days 00:00:00.448572,0.001545906779428604,balanced,robust,,l2,COMPLETE
143,0.33402635347698073,2026-08-15 00:17:41.367446,2026-08-15 00:17:41.803404,0 days 00:00:00.435958,0.00012088079098170567,balanced,robust,,l2,COMPLETE
144,0.3334210537785513,2026-08-15 00:17:41.811254,2026-08-15 00:17:42.258304,0 days 00:00:00.447050,0.0011900999053873367,balanced,robust,,l2,COMPLETE
145,0.33438976269125337,2026-08-15 00:17:42.265193,2026-08-15 00:17:42.702275,0 days 00:00:00.437082,0.00012770236687556375,balanced,robust,,l2,COMPLETE
146,0.33683289494870383,2026-08-15 00:17:42.708067,2026-08-15 00:17:43.144795,0 days 00:00:00.436728,0.00010273331056938201,balanced,robust,,l2,COMPLETE
147,0.3364666663485747,2026-08-15 00:17:43.151692,2026-08-15 00:17:43.588769,0 days 00:00:00.437077,0.00010636799200043902,balanced,robust,,l2,COMPLETE
148,0.33363975946132957,2026-08-15 00:17:43.595383,2026-08-15 00:17:44.031948,0 days 00:00:00.436565,0.00012222502015291265,balanced,robust,,l2,COMPLETE
149,0.3232293808348153,2026-08-15 00:17:44.037877,2026-08-15 00:17:47.858907,0 days 00:00:03.821030,44.891246074942366,none,standard,0.5455318850894016,elasticnet,COMPLETE
