number,value,datetime_start,datetime_complete,duration,params_C,params_class_weight,params_escalador,params_l1_ratio,params_penalty,state
0,0.30830874695851174,2026-08-15 00:14:40.320945,2026-08-15 00:14:45.369677,0 days 00:00:05.048732,1.55099139875943,balanced,robust,,l2,COMPLETE
1,0.30638490655174233,2026-08-15 00:14:45.376688,2026-08-15 00:14:49.496470,0 days 00:00:04.119782,615.6997328235198,balanced,robust,,l2,COMPLETE
2,0.3282052191890164,2026-08-15 00:14:49.502540,2026-08-15 00:14:53.604210,0 days 00:00:04.101670,0.010929592787219389,balanced,robust,,l2,COMPLETE
3,0.31152335545842996,2026-08-15 00:14:53.682388,2026-08-15 00:14:57.962247,0 days 00:00:04.279859,0.3977782830811188,balanced,standard,,l2,COMPLETE
4,0.3194887947864607,2026-08-15 00:14:57.980920,2026-08-15 00:15:01.915790,0 days 00:00:03.934870,45.5807468402732,balanced,standard,0.12203823484477883,elasticnet,COMPLETE
5,0.32590188497697614,2026-08-15 00:15:01.922280,2026-08-15 00:15:02.709214,0 days 00:00:00.786934,0.006478282331897323,balanced,robust,0.18485445552552704,elasticnet,COMPLETE
6,0.3209484645088089,2026-08-15 00:15:02.782285,2026-08-15 00:15:10.306706,0 days 00:00:07.524421,183.5656654435504,none,robust,,l1,COMPLETE
7,0.32657556052972875,2026-08-15 00:15:10.313117,2026-08-15 00:15:11.315362,0 days 00:00:01.002245,0.00793310536373302,balanced,robust,0.14092422497476265,elasticnet,COMPLETE
8,0.31987775603737995,2026-08-15 00:15:11.322631,2026-08-15 00:15:15.580524,0 days 00:00:04.257893,25.45150013091291,balanced,standard,0.7290071680409873,elasticnet,COMPLETE
9,0.15558452846588441,2026-08-15 00:15:15.587140,2026-08-15 00:15:15.712088,0 days 00:00:00.124948,0.0006472669269538638,balanced,standard,,l1,COMPLETE
10,0.31205214448383084,2026-08-15 00:15:15.719383,2026-08-15 00:15:22.301200,0 days 00:00:06.581817,2.903369428128561,balanced,robust,0.7607850486168974,elasticnet,COMPLETE
11,0.305609372013577,2026-08-15 00:15:22.307312,2026-08-15 00:15:26.954299,0 days 00:00:04.646987,0.45617324056306324,balanced,standard,,l2,COMPLETE
12,0.3227725369545243,2026-08-15 00:15:26.960609,2026-08-15 00:15:30.862967,0 days 00:00:03.902358,225.40591970426073,none,standard,,l1,COMPLETE
13,0.31093186163694836,2026-08-15 00:15:30.869187,2026-08-15 00:15:35.484536,0 days 00:00:04.615349,322.02053440422935,balanced,standard,,l2,COMPLETE
14,0.31042572107354693,2026-08-15 00:15:35.490406,2026-08-15 00:15:40.265660,0 days 00:00:04.775254,44.88291820002602,balanced,robust,,l2,COMPLETE
15,0.15558452846588441,2026-08-15 00:15:40.271477,2026-08-15 00:15:40.396705,0 days 00:00:00.125228,0.00011185744978598925,balanced,standard,0.33761517140362796,elasticnet,COMPLETE
16,0.32318815343101165,2026-08-15 00:15:40.402953,2026-08-15 00:15:44.314435,0 days 00:00:03.911482,8.339359809165781,none,standard,,l1,COMPLETE
17,0.18881213598808075,2026-08-15 00:15:44.321157,2026-08-15 00:15:44.474416,0 days 00:00:00.153259,0.000181221045447858,balanced,robust,,l1,COMPLETE
18,0.32400699208428885,2026-08-15 00:15:44.480972,2026-08-15 00:15:46.701049,0 days 00:00:02.220077,0.26678986172428065,balanced,robust,,l1,COMPLETE
19,0.30464631207896326,2026-08-15 00:15:46.706910,2026-08-15 00:15:51.416556,0 days 00:00:04.709646,2.6677234978367657,balanced,robust,,l2,COMPLETE
20,0.32064613187496627,2026-08-15 00:15:51.423605,2026-08-15 00:15:55.427734,0 days 00:00:04.004129,1.3685182782317267,balanced,standard,,l1,COMPLETE
21,0.3229944355699957,2026-08-15 00:15:55.444067,2026-08-15 00:15:55.758318,0 days 00:00:00.314251,0.05095037961028773,balanced,standard,0.9246936182785628,elasticnet,COMPLETE
22,0.3194887947864607,2026-08-15 00:15:55.765426,2026-08-15 00:15:59.533430,0 days 00:00:03.768004,52.54790443347549,balanced,standard,,l1,COMPLETE
23,0.32234795878395556,2026-08-15 00:15:59.540584,2026-08-15 00:16:04.181051,0 days 00:00:04.640467,0.0236161194792022,none,standard,,l2,COMPLETE
24,0.279273591004074,2026-08-15 00:16:04.187742,2026-08-15 00:16:04.575220,0 days 00:00:00.387478,0.0013533215536719134,balanced,robust,,l1,COMPLETE
25,0.3360035903537381,2026-08-15 00:16:04.581422,2026-08-15 00:16:05.511903,0 days 00:00:00.930481,0.012874998687240156,balanced,robust,0.031231816154402514,elasticnet,COMPLETE
26,0.31540927101661975,2026-08-15 00:16:05.518612,2026-08-15 00:16:06.014910,0 days 00:00:00.496298,0.0030180350681013367,none,robust,0.013092435717001583,elasticnet,COMPLETE
27,0.3354554386347408,2026-08-15 00:16:06.021367,2026-08-15 00:16:10.656863,0 days 00:00:04.635496,0.005529917708060829,balanced,robust,,l2,COMPLETE
28,0.3341610166594462,2026-08-15 00:16:10.663970,2026-08-15 00:16:15.213964,0 days 00:00:04.549994,0.0016411423906338924,balanced,robust,,l2,COMPLETE
29,0.32271348826022267,2026-08-15 00:16:15.281340,2026-08-15 00:16:19.805100,0 days 00:00:04.523760,0.004155616050303108,none,robust,,l2,COMPLETE
30,0.3360563101982051,2026-08-15 00:16:19.942623,2026-08-15 00:16:20.383732,0 days 00:00:00.441109,0.00011086142696502049,balanced,robust,,l2,COMPLETE
31,0.3335650648421638,2026-08-15 00:16:20.434906,2026-08-15 00:16:20.989603,0 days 00:00:00.554697,0.003423234755003212,balanced,robust,,l2,COMPLETE
32,0.3400874666201427,2026-08-15 00:16:20.996031,2026-08-15 00:16:21.439203,0 days 00:00:00.443172,0.00016491236228800314,balanced,robust,,l2,COMPLETE
33,0.33768873208321076,2026-08-15 00:16:21.493935,2026-08-15 00:16:21.935653,0 days 00:00:00.441718,0.00015188787961541977,balanced,robust,,l2,COMPLETE
34,0.33805586248584535,2026-08-15 00:16:22.022319,2026-08-15 00:16:22.467965,0 days 00:00:00.445646,0.00020307023507827896,balanced,robust,,l2,COMPLETE
35,0.3334380264630085,2026-08-15 00:16:22.475393,2026-08-15 00:16:22.881554,0 days 00:00:00.406161,0.00020598818499269287,balanced,standard,,l2,COMPLETE
36,0.3366734090430142,2026-08-15 00:16:22.917512,2026-08-15 00:16:23.359144,0 days 00:00:00.441632,0.0004185697392909356,balanced,robust,,l2,COMPLETE
37,0.18881213598808075,2026-08-15 00:16:23.414516,2026-08-15 00:16:23.574364,0 days 00:00:00.159848,0.00010497918438524268,balanced,robust,0.5121469690533348,elasticnet,COMPLETE
38,0.3364658026985358,2026-08-15 00:16:23.580842,2026-08-15 00:16:24.025138,0 days 00:00:00.444296,0.00010299947644681013,balanced,robust,,l2,COMPLETE
39,0.3361868836075499,2026-08-15 00:16:24.123263,2026-08-15 00:16:24.577957,0 days 00:00:00.454694,0.00013595134662196197,balanced,robust,,l2,COMPLETE
40,0.3364658026985358,2026-08-15 00:16:24.659984,2026-08-15 00:16:25.103438,0 days 00:00:00.443454,0.00010241351764471082,balanced,robust,,l2,COMPLETE
41,0.3379031605459666,2026-08-15 00:16:25.110521,2026-08-15 00:16:25.554470,0 days 00:00:00.443949,0.0001464328846329171,balanced,robust,,l2,COMPLETE
42,0.3357122614064492,2026-08-15 00:16:25.596457,2026-08-15 00:16:26.042368,0 days 00:00:00.445911,0.000644663359699192,balanced,robust,,l2,COMPLETE
43,0.28166028456297826,2026-08-15 00:16:26.048395,2026-08-15 00:16:26.495976,0 days 00:00:00.447581,0.0001324010844609675,none,robust,,l2,COMPLETE
44,0.18881213598808075,2026-08-15 00:16:26.592765,2026-08-15 00:16:26.761946,0 days 00:00:00.169181,0.0005892588565110694,none,robust,,l1,COMPLETE
45,0.3364720954746719,2026-08-15 00:16:26.768217,2026-08-15 00:16:27.227972,0 days 00:00:00.459755,0.00010737332247046417,balanced,robust,,l2,COMPLETE
46,0.28813894448308863,2026-08-15 00:16:27.249209,2026-08-15 00:16:27.549918,0 days 00:00:00.300709,0.006331657620392352,none,standard,,l1,COMPLETE
47,0.31707235659502825,2026-08-15 00:16:27.570757,2026-08-15 00:16:28.127949,0 days 00:00:00.557192,344.9329336031796,none,robust,,l2,COMPLETE
48,0.32139761391193394,2026-08-15 00:16:28.133929,2026-08-15 00:16:35.087317,0 days 00:00:06.953388,59.21416079179743,none,robust,0.41476197469377063,elasticnet,COMPLETE
49,0.18881213598808075,2026-08-15 00:16:35.094678,2026-08-15 00:16:35.231145,0 days 00:00:00.136467,0.0005856884653850386,none,standard,0.5794770921495668,elasticnet,COMPLETE
50,0.3230782864396983,2026-08-15 00:16:35.236866,2026-08-15 00:16:35.674122,0 days 00:00:00.437256,0.009140728773905083,balanced,standard,,l2,COMPLETE
51,0.3375513604572527,2026-08-15 00:16:35.680729,2026-08-15 00:16:36.117015,0 days 00:00:00.436286,0.00018823049990228475,balanced,robust,,l2,COMPLETE
52,0.33286403819149535,2026-08-15 00:16:36.124495,2026-08-15 00:16:36.572674,0 days 00:00:00.448179,0.0018050829165118254,balanced,robust,,l2,COMPLETE
53,0.3368334170084717,2026-08-15 00:16:36.579099,2026-08-15 00:16:37.015678,0 days 00:00:00.436579,0.00010493924647968672,balanced,robust,,l2,COMPLETE
54,0.33402635347698073,2026-08-15 00:16:37.022379,2026-08-15 00:16:37.466979,0 days 00:00:00.444600,0.00011554146807029777,balanced,robust,,l2,COMPLETE
55,0.3361855531710993,2026-08-15 00:16:37.473777,2026-08-15 00:16:37.914435,0 days 00:00:00.440658,0.00013672941861761172,balanced,robust,,l2,COMPLETE
56,0.33363975946132957,2026-08-15 00:16:37.922009,2026-08-15 00:16:38.358491,0 days 00:00:00.436482,0.00012237996434002067,balanced,robust,,l2,COMPLETE
57,0.31073505771598525,2026-08-15 00:16:38.365879,2026-08-15 00:16:45.745462,0 days 00:00:07.379583,801.9638384826379,balanced,robust,,l1,COMPLETE
58,0.333698021462106,2026-08-15 00:16:45.752386,2026-08-15 00:16:46.155941,0 days 00:00:00.403555,0.00021616336513527747,balanced,standard,,l2,COMPLETE
59,0.2909127212551481,2026-08-15 00:16:46.162121,2026-08-15 00:16:46.564148,0 days 00:00:00.402027,0.00012312503700967223,none,standard,,l2,COMPLETE
60,0.3364666663485747,2026-08-15 00:16:46.572312,2026-08-15 00:16:47.030156,0 days 00:00:00.457844,0.00010637717348547973,balanced,robust,,l2,COMPLETE
61,0.3358362197728047,2026-08-15 00:16:47.038150,2026-08-15 00:16:47.501038,0 days 00:00:00.462888,0.004098306046414126,balanced,robust,,l2,COMPLETE
62,0.3167444768503766,2026-08-15 00:16:47.507424,2026-08-15 00:16:47.952938,0 days 00:00:00.445514,14.450876932287512,none,standard,,l2,COMPLETE
63,0.33329983458104295,2026-08-15 00:16:47.959977,2026-08-15 00:16:48.412888,0 days 00:00:00.452911,0.0016810168941906523,balanced,robust,,l2,COMPLETE
64,0.18881213598808075,2026-08-15 00:16:48.419599,2026-08-15 00:16:48.586034,0 days 00:00:00.166435,0.00037837182945853133,balanced,robust,,l1,COMPLETE
65,0.3365375832007975,2026-08-15 00:16:48.592819,2026-08-15 00:16:49.039513,0 days 00:00:00.446694,0.0007333836307470475,balanced,robust,,l2,COMPLETE
66,0.33402466594061453,2026-08-15 00:16:49.046244,2026-08-15 00:16:49.482357,0 days 00:00:00.436113,0.00011674384291245223,balanced,robust,,l2,COMPLETE
67,0.18881213598808075,2026-08-15 00:16:49.488292,2026-08-15 00:16:49.641361,0 days 00:00:00.153069,0.00025520225824555255,balanced,robust,0.9421605141410054,elasticnet,COMPLETE
68,0.3343721419959789,2026-08-15 00:16:49.647986,2026-08-15 00:16:50.096453,0 days 00:00:00.448467,0.0018438177436828366,balanced,robust,,l2,COMPLETE
69,0.3161138984098599,2026-08-15 00:16:50.104420,2026-08-15 00:16:50.606964,0 days 00:00:00.502544,0.9272471960542883,none,robust,,l2,COMPLETE
70,0.3224612058436107,2026-08-15 00:16:50.614986,2026-08-15 00:16:53.239959,0 days 00:00:02.624973,0.41539344923719423,none,robust,,l1,COMPLETE
71,0.3327271018520185,2026-08-15 00:16:53.246443,2026-08-15 00:16:53.694710,0 days 00:00:00.448267,0.0015558240579156767,balanced,robust,,l2,COMPLETE
72,0.335217544706029,2026-08-15 00:16:53.701164,2026-08-15 00:16:54.148163,0 days 00:00:00.446999,0.0009792451134732197,balanced,robust,,l2,COMPLETE
73,0.3364658026985358,2026-08-15 00:16:54.155051,2026-08-15 00:16:54.589659,0 days 00:00:00.434608,0.00010217101147640074,balanced,robust,,l2,COMPLETE
74,0.30881704776028684,2026-08-15 00:16:54.597023,2026-08-15 00:16:55.034969,0 days 00:00:00.437946,0.0005958470628057462,none,robust,,l2,COMPLETE
75,0.18881213598808075,2026-08-15 00:16:55.041139,2026-08-15 00:16:55.192811,0 days 00:00:00.151672,0.00010014520663461644,none,robust,0.5900651528469971,elasticnet,COMPLETE
76,0.33612348090223193,2026-08-15 00:16:55.199433,2026-08-15 00:16:55.649765,0 days 00:00:00.450332,0.0009311038021509088,balanced,robust,,l2,COMPLETE
77,0.3364720954746719,2026-08-15 00:16:55.657501,2026-08-15 00:16:56.097104,0 days 00:00:00.439603,0.00010704291903373221,balanced,robust,,l2,COMPLETE
78,0.333331502645279,2026-08-15 00:16:56.104303,2026-08-15 00:16:56.556371,0 days 00:00:00.452068,0.0011103370894226233,balanced,robust,,l2,COMPLETE
79,0.3349940953156693,2026-08-15 00:16:56.563808,2026-08-15 00:16:57.002593,0 days 00:00:00.438785,0.00010001947484650685,balanced,robust,,l2,COMPLETE
80,0.3326889806368431,2026-08-15 00:16:57.009396,2026-08-15 00:16:57.453447,0 days 00:00:00.444051,0.0014624232111820862,balanced,robust,,l2,COMPLETE
81,0.33438976269125337,2026-08-15 00:16:57.459510,2026-08-15 00:16:57.897461,0 days 00:00:00.437951,0.00012692862936505107,balanced,robust,,l2,COMPLETE
82,0.33402466594061453,2026-08-15 00:16:57.905300,2026-08-15 00:16:58.345650,0 days 00:00:00.440350,0.00011713950956205588,balanced,robust,,l2,COMPLETE
83,0.33363975946132957,2026-08-15 00:16:58.352969,2026-08-15 00:16:58.792765,0 days 00:00:00.439796,0.00012417314118577842,balanced,robust,,l2,COMPLETE
84,0.18881213598808075,2026-08-15 00:16:58.799604,2026-08-15 00:16:58.956228,0 days 00:00:00.156624,0.00010283215896812727,balanced,robust,,l1,COMPLETE
85,0.3368334170084717,2026-08-15 00:16:58.961984,2026-08-15 00:16:59.405628,0 days 00:00:00.443644,0.00010600764636539372,balanced,robust,,l2,COMPLETE
86,0.3329866689490886,2026-08-15 00:16:59.411874,2026-08-15 00:16:59.858103,0 days 00:00:00.446229,0.0021563023845923043,balanced,robust,,l2,COMPLETE
87,0.3360591892009533,2026-08-15 00:16:59.864323,2026-08-15 00:17:00.317909,0 days 00:00:00.453586,0.00011131099941095531,balanced,robust,,l2,COMPLETE
88,0.33210321352062416,2026-08-15 00:17:00.325013,2026-08-15 00:17:00.722072,0 days 00:00:00.397059,0.00018342646972886137,balanced,standard,,l2,COMPLETE
89,0.3099454254256265,2026-08-15 00:17:00.729505,2026-08-15 00:17:01.068058,0 days 00:00:00.338553,0.0011296982178383766,balanced,robust,0.31895351078905515,elasticnet,COMPLETE
90,0.2785461120886606,2026-08-15 00:17:01.075988,2026-08-15 00:17:01.511732,0 days 00:00:00.435744,0.00011777351680510572,none,robust,,l2,COMPLETE
91,0.33526094890615843,2026-08-15 00:17:01.519455,2026-08-15 00:17:01.956522,0 days 00:00:00.437067,0.00021015819810718805,balanced,robust,,l2,COMPLETE
92,0.33921182581136894,2026-08-15 00:17:01.963343,2026-08-15 00:17:02.403293,0 days 00:00:00.439950,0.00017234397807822595,balanced,robust,,l2,COMPLETE
93,0.3364666663485747,2026-08-15 00:17:02.409933,2026-08-15 00:17:02.861051,0 days 00:00:00.451118,0.00010635407503410735,balanced,robust,,l2,COMPLETE
94,0.30560896042748276,2026-08-15 00:17:02.868494,2026-08-15 00:17:03.337307,0 days 00:00:00.468813,0.2126720501169415,balanced,robust,,l2,COMPLETE
95,0.3200210751733236,2026-08-15 00:17:03.344141,2026-08-15 00:17:07.295405,0 days 00:00:03.951264,795.6391842568064,balanced,standard,0.997591630991713,elasticnet,COMPLETE
96,0.15558452846588441,2026-08-15 00:17:07.301605,2026-08-15 00:17:07.423302,0 days 00:00:00.121697,0.0005637997752757339,balanced,standard,,l1,COMPLETE
97,0.33231786918738576,2026-08-15 00:17:07.428949,2026-08-15 00:17:07.880264,0 days 00:00:00.451315,0.0020837711218349595,balanced,robust,,l2,COMPLETE
98,0.33236327019863604,2026-08-15 00:17:07.887744,2026-08-15 00:17:08.339697,0 days 00:00:00.451953,0.001124895945880078,balanced,robust,,l2,COMPLETE
99,0.33363975946132957,2026-08-15 00:17:08.346035,2026-08-15 00:17:08.782625,0 days 00:00:00.436590,0.00012227866910442432,balanced,robust,,l2,COMPLETE
100,0.3146721835094114,2026-08-15 00:17:08.789486,2026-08-15 00:17:09.217545,0 days 00:00:00.428059,0.0042305684176955835,balanced,robust,,l1,COMPLETE
101,0.3357297036933466,2026-08-15 00:17:09.225846,2026-08-15 00:17:09.673987,0 days 00:00:00.448141,0.00014188684056178752,balanced,robust,,l2,COMPLETE
102,0.33402635347698073,2026-08-15 00:17:09.681080,2026-08-15 00:17:10.126104,0 days 00:00:00.445024,0.00011546798797835584,balanced,robust,,l2,COMPLETE
103,0.3330290048656035,2026-08-15 00:17:10.133826,2026-08-15 00:17:10.584693,0 days 00:00:00.450867,0.0011925002681093294,balanced,robust,,l2,COMPLETE
104,0.3364720954746719,2026-08-15 00:17:10.591870,2026-08-15 00:17:11.029810,0 days 00:00:00.437940,0.00010678070133773385,balanced,robust,,l2,COMPLETE
105,0.33402635347698073,2026-08-15 00:17:11.037246,2026-08-15 00:17:11.477045,0 days 00:00:00.439799,0.00011961080008914302,balanced,robust,,l2,COMPLETE
106,0.33291306163480344,2026-08-15 00:17:11.485081,2026-08-15 00:17:11.920852,0 days 00:00:00.435771,0.0018943794223701532,balanced,robust,,l2,COMPLETE
107,0.32432326118963234,2026-08-15 00:17:11.927613,2026-08-15 00:17:15.195968,0 days 00:00:03.268355,0.40536755792124674,none,standard,0.6727347112066642,elasticnet,COMPLETE
108,0.18881213598808075,2026-08-15 00:17:15.203132,2026-08-15 00:17:15.357125,0 days 00:00:00.153993,0.0001104782473106311,balanced,robust,0.39545189678297765,elasticnet,COMPLETE
109,0.33462922916772914,2026-08-15 00:17:15.363137,2026-08-15 00:17:15.802682,0 days 00:00:00.439545,0.00010053027265396969,balanced,robust,,l2,COMPLETE
110,0.3327271018520185,2026-08-15 00:17:15.809326,2026-08-15 00:17:16.259133,0 days 00:00:00.449807,0.0015440019235207424,balanced,robust,,l2,COMPLETE
111,0.33402466594061453,2026-08-15 00:17:16.266461,2026-08-15 00:17:16.710304,0 days 00:00:00.443843,0.00011574923126882568,balanced,robust,,l2,COMPLETE
112,0.3357297036933466,2026-08-15 00:17:16.716483,2026-08-15 00:17:17.152689,0 days 00:00:00.436206,0.00014190366340348379,balanced,robust,,l2,COMPLETE
113,0.33363975946132957,2026-08-15 00:17:17.159301,2026-08-15 00:17:17.605976,0 days 00:00:00.446675,0.00012311128074082462,balanced,robust,,l2,COMPLETE
114,0.3368334170084717,2026-08-15 00:17:17.612666,2026-08-15 00:17:18.048148,0 days 00:00:00.435482,0.00010524793944954136,balanced,robust,,l2,COMPLETE
115,0.33471284360524384,2026-08-15 00:17:18.054879,2026-08-15 00:17:18.500495,0 days 00:00:00.445616,0.0026331383456060266,balanced,robust,,l2,COMPLETE
116,0.3333462317493516,2026-08-15 00:17:18.506297,2026-08-15 00:17:18.915705,0 days 00:00:00.409408,0.003427149728378381,balanced,standard,,l2,COMPLETE
117,0.33363975946132957,2026-08-15 00:17:18.922712,2026-08-15 00:17:19.357753,0 days 00:00:00.435041,0.0001246010279660448,balanced,robust,,l2,COMPLETE
118,0.33200308750459256,2026-08-15 00:17:19.364414,2026-08-15 00:17:19.811172,0 days 00:00:00.446758,0.0015817367759942864,balanced,robust,,l2,COMPLETE
119,0.3233986016596912,2026-08-15 00:17:19.817562,2026-08-15 00:17:20.274552,0 days 00:00:00.456990,0.009753251624188936,none,robust,,l2,COMPLETE
120,0.3368167752049753,2026-08-15 00:17:20.282059,2026-08-15 00:17:20.717424,0 days 00:00:00.435365,0.00011328485320303182,balanced,robust,,l2,COMPLETE
121,0.3348366576870827,2026-08-15 00:17:20.725322,2026-08-15 00:17:21.175424,0 days 00:00:00.450102,0.00011498467004242416,balanced,robust,,l2,COMPLETE
122,0.3352036722925618,2026-08-15 00:17:21.181266,2026-08-15 00:17:21.621614,0 days 00:00:00.440348,0.00011464540140946898,balanced,robust,,l2,COMPLETE
123,0.3335720717155802,2026-08-15 00:17:21.628766,2026-08-15 00:17:22.070207,0 days 00:00:00.441441,0.001161682104955904,balanced,robust,,l2,COMPLETE
124,0.33934635171121297,2026-08-15 00:17:22.076128,2026-08-15 00:17:22.517300,0 days 00:00:00.441172,0.00014693244125982063,balanced,robust,,l2,COMPLETE
125,0.3352036722925618,2026-08-15 00:17:22.523868,2026-08-15 00:17:22.964352,0 days 00:00:00.440484,0.00011490863602138113,balanced,robust,,l2,COMPLETE
126,0.3336711207862153,2026-08-15 00:17:22.971374,2026-08-15 00:17:23.425512,0 days 00:00:00.454138,0.0016291667028047274,balanced,robust,,l2,COMPLETE
127,0.31073505771598525,2026-08-15 00:17:23.432957,2026-08-15 00:17:30.240477,0 days 00:00:06.807520,48.32863365417852,balanced,robust,0.7855709119618257,elasticnet,COMPLETE
128,0.3335734420071769,2026-08-15 00:17:30.247216,2026-08-15 00:17:30.683651,0 days 00:00:00.436435,0.00012910960299908732,balanced,robust,,l2,COMPLETE
129,0.3327556518472815,2026-08-15 00:17:30.690592,2026-08-15 00:17:31.134170,0 days 00:00:00.443578,0.0010912911036839738,balanced,robust,,l2,COMPLETE
130,0.18881213598808075,2026-08-15 00:17:31.140936,2026-08-15 00:17:31.292879,0 days 00:00:00.151943,0.00022197386657774992,balanced,robust,,l1,COMPLETE
131,0.3364666663485747,2026-08-15 00:17:31.299258,2026-08-15 00:17:31.746827,0 days 00:00:00.447569,0.00010644755008954689,balanced,robust,,l2,COMPLETE
132,0.33363975946132957,2026-08-15 00:17:31.753175,2026-08-15 00:17:32.189820,0 days 00:00:00.436645,0.00012193709490443812,balanced,robust,,l2,COMPLETE
133,0.3364720954746719,2026-08-15 00:17:32.197096,2026-08-15 00:17:32.634541,0 days 00:00:00.437445,0.00010756204298471881,balanced,robust,,l2,COMPLETE
134,0.3340603589419775,2026-08-15 00:17:32.640639,2026-08-15 00:17:33.038786,0 days 00:00:00.398147,0.0002863319926882798,balanced,standard,,l2,COMPLETE
135,0.3322206493889695,2026-08-15 00:17:33.045623,2026-08-15 00:17:33.483509,0 days 00:00:00.437886,0.001364819982669815,balanced,robust,,l2,COMPLETE
136,0.3368334170084717,2026-08-15 00:17:33.491850,2026-08-15 00:17:33.933619,0 days 00:00:00.441769,0.00010610720526934446,balanced,robust,,l2,COMPLETE
137,0.30257083935193346,2026-08-15 00:17:33.940086,2026-08-15 00:17:34.379681,0 days 00:00:00.439595,0.0004171127847836153,none,robust,,l2,COMPLETE
138,0.336814080478697,2026-08-15 00:17:34.386377,2026-08-15 00:17:34.823106,0 days 00:00:00.436729,0.00011297087978861354,balanced,robust,,l2,COMPLETE
139,0.3360591892009533,2026-08-15 00:17:34.830348,2026-08-15 00:17:35.268876,0 days 00:00:00.438528,0.00011130492596147896,balanced,robust,,l2,COMPLETE
140,0.31823171435677694,2026-08-15 00:17:35.274557,2026-08-15 00:17:40.444736,0 days 00:00:05.170179,0.5752827242114985,none,robust,0.29940211700435826,elasticnet,COMPLETE
