number,value,datetime_start,datetime_complete,duration,params_batch,params_bidir,params_class_weight,params_criterio,params_dropout,params_escalador,params_focal_gamma,params_grad_clip,params_hidden,params_label_smooth,params_layers,params_lookback,params_loss,params_lr,params_pooling,params_scheduler,params_weight_decay,state
0,0.31411846918085573,2026-08-14 21:52:34.172193,2026-08-14 21:52:56.154909,0 days 00:00:21.982716,128,True,sqrt,val_f1,0.519705687464961,robust,1.9810364221551062,0.5,18,,2,10,focal,0.0003083434817935577,meanmax,plateau,0.0034702669886504172,COMPLETE
1,0.3362450895154352,2026-08-14 21:52:56.162589,2026-08-14 21:53:09.946477,0 days 00:00:13.783888,256,True,balanced,val_f1_ma3,0.5455922412472692,standard,,1.0,71,0.05618690193747616,1,40,ce,4.375517173207357e-05,last,none,0.002054051942538846,COMPLETE
2,0.3350498605418675,2026-08-14 21:53:09.953199,2026-08-14 21:54:31.892549,0 days 00:01:21.939350,64,False,sqrt,val_f1,0.06952143571507782,standard,0.5785729642168356,5.0,92,,1,20,focal,0.0013740794394697655,attn,none,0.0013076473382928546,COMPLETE
3,0.25447537491506206,2026-08-14 21:54:31.901701,2026-08-14 21:54:55.669423,0 days 00:00:23.767722,512,True,balanced,val_f1_ma3,0.5228763541126306,robust,,1.0,111,0.10375812434867322,2,20,ce,0.0009790236510178586,meanmax,none,8.56742466787506e-06,COMPLETE
4,0.2637677101885879,2026-08-14 21:54:55.677507,2026-08-14 21:55:29.499683,0 days 00:00:33.822176,64,False,none,val_f1_ma3,0.14373713440018346,robust,,1.0,29,0.1024186116598562,2,60,ce,2.2851892235553444e-05,meanmax,cosine,0.00028006820077310237,COMPLETE
5,0.338316561759129,2026-08-14 21:55:29.506639,2026-08-14 21:55:51.097125,0 days 00:00:21.590486,256,True,sqrt,val_f1_ma3,0.3331204869596774,minmax,0.5126539596155467,0.5,24,,2,10,focal,0.0002051203293779096,meanmax,plateau,1.6190544494716505e-05,COMPLETE
6,0.316344929262913,2026-08-14 21:55:51.104742,2026-08-14 21:58:03.266214,0 days 00:02:12.161472,64,True,balanced,val_f1,0.2206294818356601,robust,,5.0,210,0.003091323305773486,2,10,ce,4.53877257250326e-05,last,none,1.6593890383815802e-05,COMPLETE
7,0.30814846797580886,2026-08-14 21:58:03.274616,2026-08-14 21:58:17.318599,0 days 00:00:14.043983,256,False,none,val_loss,0.05830589626246112,standard,2.7250133545439157,1.0,40,,2,20,focal,0.00033377013398032054,attn,none,0.08918036602897811,COMPLETE
8,0.33229435051521794,2026-08-14 21:58:17.326428,2026-08-14 21:58:41.865713,0 days 00:00:24.539285,64,False,sqrt,val_f1,0.3133459560328826,robust,,0.5,25,0.08179058888285398,1,20,ce,0.000807918208873933,last,plateau,1.1997897226934485e-05,COMPLETE
9,0.31879779371321865,2026-08-14 21:58:41.872687,2026-08-14 21:59:22.800381,0 days 00:00:40.927694,256,True,sqrt,val_loss,0.45470766627862147,robust,2.146734079047363,5.0,24,,1,10,focal,1.0855614604261917e-05,meanmax,plateau,3.805074835058824e-06,COMPLETE
10,0.3078941826959609,2026-08-14 21:59:22.808070,2026-08-14 22:00:58.530620,0 days 00:01:35.722550,512,True,sqrt,val_f1,0.5432103851736382,minmax,,1.0,149,0.1501229503281717,3,60,ce,3.0549097281632174e-05,attn,cosine,2.2223195374893766e-06,COMPLETE
11,0.2928387097540878,2026-08-14 22:00:58.539092,2026-08-14 22:01:29.041287,0 days 00:00:30.502195,256,True,sqrt,val_loss,0.49587447966464493,standard,0.6438969000416107,5.0,72,,2,40,focal,6.205855646103131e-05,attn,cosine,0.0300342051204874,COMPLETE
12,0.3036730591628729,2026-08-14 22:01:29.049649,2026-08-14 22:01:36.904856,0 days 00:00:07.855207,512,False,balanced,val_loss,0.04880926838513986,minmax,0.7938156169427621,1.0,96,,3,40,focal,1.6223826929363506e-05,attn,cosine,0.08574284557962648,COMPLETE
13,0.27088032853253635,2026-08-14 22:01:36.912862,2026-08-14 22:02:22.379140,0 days 00:00:45.466278,64,True,none,val_f1,0.5957788776715802,minmax,,0.5,19,0.11673122237017441,3,10,ce,1.5233617230313584e-05,attn,plateau,0.0005878566318396012,COMPLETE
14,0.3033561231191514,2026-08-14 22:02:22.387476,2026-08-14 22:02:36.823357,0 days 00:00:14.435881,512,True,balanced,val_f1_ma3,0.2509458217743713,robust,2.9915920926847637,0.5,74,,3,20,focal,0.0020440031040978753,meanmax,cosine,0.02139535256831786,COMPLETE
15,0.34376583905235336,2026-08-14 22:02:36.832487,2026-08-14 22:03:03.080810,0 days 00:00:26.248323,128,True,balanced,val_loss,0.40294391735567975,robust,2.760396736234371,0.5,41,,2,10,focal,0.00019447566486155575,attn,cosine,0.007270963402444571,COMPLETE
16,0.28464467662084264,2026-08-14 22:03:03.089304,2026-08-14 22:03:21.678608,0 days 00:00:18.589304,512,False,none,val_f1,0.19725096617250493,robust,,0.5,56,0.024127174220120163,1,40,ce,0.0003706898708058801,attn,cosine,1.587552491481867e-05,COMPLETE
17,0.32201701549334966,2026-08-14 22:03:21.688770,2026-08-14 22:03:30.357284,0 days 00:00:08.668514,256,True,none,val_f1_ma3,0.448955814230195,standard,0.5501779944443159,1.0,38,,1,10,focal,2.8647118133838996e-05,last,none,1.1136446029400991e-05,COMPLETE
18,0.3067335782894786,2026-08-14 22:03:30.365881,2026-08-14 22:03:38.735657,0 days 00:00:08.369776,512,True,balanced,val_loss,0.07654818167733825,minmax,0.7800972554201309,1.0,47,,3,40,focal,5.0460009486762804e-05,attn,cosine,6.537496690081766e-05,PRUNED
19,0.27726190674052736,2026-08-14 22:03:38.741855,2026-08-14 22:03:43.045951,0 days 00:00:04.304096,128,True,sqrt,val_loss,0.25526186316985006,minmax,,1.0,49,0.09431523771003168,2,20,ce,0.00018088912506874998,last,cosine,1.6294786031575234e-05,PRUNED
20,0.2482114829643928,2026-08-14 22:03:43.051579,2026-08-14 22:03:51.472765,0 days 00:00:08.421186,128,True,none,val_loss,0.4771603871159341,robust,2.7661802774113675,5.0,89,,1,40,focal,3.1583141060896896e-05,attn,plateau,6.580815488709269e-06,PRUNED
21,0.3201351381735057,2026-08-14 22:03:51.478850,2026-08-14 22:04:12.346315,0 days 00:00:20.867465,128,False,none,val_f1_ma3,0.4463677755436062,standard,0.9539942920035642,1.0,198,,2,10,focal,1.2107762872143419e-05,last,cosine,0.0007070472286699655,COMPLETE
22,0.2996917051356718,2026-08-14 22:04:12.354267,2026-08-14 22:04:14.266512,0 days 00:00:01.912245,512,False,balanced,val_f1,0.5534996287063774,standard,2.5071336214950284,1.0,16,,2,20,focal,0.0005648275259793386,last,cosine,5.790221992768041e-06,PRUNED
23,0.26064009025600743,2026-08-14 22:04:14.272467,2026-08-14 22:04:16.445148,0 days 00:00:02.172681,512,False,none,val_loss,0.25135526970272876,robust,,1.0,58,0.007309933569618976,2,60,ce,0.0018457982348362018,meanmax,none,6.485888757042121e-05,PRUNED
24,0.3385819422744174,2026-08-14 22:04:16.452320,2026-08-14 22:04:26.465884,0 days 00:00:10.013564,256,False,sqrt,val_f1,0.16244680388613225,robust,2.575549661417479,0.5,47,,3,40,focal,0.00039379024774342916,last,plateau,0.00011057854100925238,COMPLETE
25,0.3408591109999967,2026-08-14 22:04:26.474155,2026-08-14 22:04:46.188823,0 days 00:00:19.714668,128,True,balanced,val_loss,0.5190213465990176,robust,1.4886171958718442,0.5,31,,1,10,focal,0.0006315502114338533,attn,none,0.0027902268281251668,COMPLETE
26,0.3478462580940919,2026-08-14 22:04:46.196175,2026-08-14 22:05:22.830291,0 days 00:00:36.634116,64,True,balanced,val_loss,0.5480596108862202,robust,1.5754729520377904,0.5,40,,1,10,focal,0.0003671388489839614,attn,none,0.009648666135029417,COMPLETE
27,0.34691310075556925,2026-08-14 22:05:22.837450,2026-08-14 22:06:03.409699,0 days 00:00:40.572249,64,False,balanced,val_loss,0.528403815927225,robust,1.6022132699233265,0.5,20,,1,10,focal,0.0006482767691329801,attn,none,0.00808228358004698,COMPLETE
28,0.29810031772030887,2026-08-14 22:06:03.416926,2026-08-14 22:07:01.960713,0 days 00:00:58.543787,64,False,balanced,val_f1_ma3,0.3659952396341939,robust,1.5605080363189212,0.5,25,,1,20,focal,0.0009166185323205405,attn,plateau,0.02137303103765555,COMPLETE
29,0.26310909119717896,2026-08-14 22:07:01.968325,2026-08-14 22:07:08.418558,0 days 00:00:06.450233,64,False,none,val_loss,0.5671106546359986,robust,1.530034484330929,0.5,26,,1,10,focal,0.0005889936660390598,attn,none,0.0059007345326552415,PRUNED
30,0.31188042066580585,2026-08-14 22:07:08.425669,2026-08-14 22:07:23.782470,0 days 00:00:15.356801,128,True,balanced,val_loss,0.33057808532580085,robust,1.7041409254067694,5.0,63,,2,20,focal,5.9535657579064136e-05,attn,cosine,0.0014269548864122284,PRUNED
31,0.31146365891380967,2026-08-14 22:07:23.788674,2026-08-14 22:07:33.401865,0 days 00:00:09.613191,128,True,balanced,val_f1_ma3,0.4431550283666506,robust,1.4117609292843076,0.5,30,,2,10,focal,0.0003718493066164735,attn,cosine,0.013948625261820656,PRUNED
32,0.30440837766287643,2026-08-14 22:07:33.407809,2026-08-14 22:07:37.540897,0 days 00:00:04.133088,128,True,balanced,val_loss,0.5671666318779052,robust,1.4558386714852252,0.5,29,,1,40,focal,0.00030547983930401663,attn,none,0.00038383519285820224,PRUNED
33,0.31306137624037117,2026-08-14 22:07:37.547257,2026-08-14 22:07:52.930703,0 days 00:00:15.383446,64,True,balanced,val_loss,0.4545740236410164,robust,,1.0,31,0.19372702028341737,1,20,ce,0.00044143927292272203,attn,none,0.036583711736650384,PRUNED
34,0.33966513876097315,2026-08-14 22:07:52.936487,2026-08-14 22:08:27.999118,0 days 00:00:35.062631,64,True,balanced,val_f1,0.422721007205898,robust,1.8478224730594432,0.5,33,,1,10,focal,0.0009623908292178993,attn,none,0.006452411961421176,COMPLETE
35,0.33360384210279176,2026-08-14 22:08:28.007784,2026-08-14 22:08:50.984045,0 days 00:00:22.976261,128,True,balanced,val_loss,0.46424553445553496,robust,1.3820329042705806,1.0,46,,2,60,focal,0.000255294136998275,last,cosine,0.009441923841651451,COMPLETE
36,0.32631476620977934,2026-08-14 22:08:51.056833,2026-08-14 22:09:08.860707,0 days 00:00:17.803874,64,False,balanced,val_loss,0.5326550902896651,robust,1.7595242358195573,0.5,21,,1,20,focal,6.712149756327327e-05,last,none,0.027323893569183504,PRUNED
37,0.33856198204796906,2026-08-14 22:09:08.866629,2026-08-14 22:09:20.743489,0 days 00:00:11.876860,512,False,balanced,val_loss,0.5702111244050727,standard,1.2741536652448366,0.5,21,,1,10,focal,0.0021807421348471337,attn,none,0.0003334271055393062,COMPLETE
38,0.32549951040479597,2026-08-14 22:09:20.778110,2026-08-14 22:10:46.972984,0 days 00:01:26.194874,64,True,balanced,val_loss,0.40867814682427117,minmax,2.1213158520621587,1.0,30,,1,10,focal,0.00020715032878590732,attn,cosine,0.01946094171116833,COMPLETE
39,0.3444725215272047,2026-08-14 22:10:46.983025,2026-08-14 22:11:06.017393,0 days 00:00:19.034368,128,True,balanced,val_loss,0.5033408520086423,robust,1.4526055731185374,0.5,46,,1,10,focal,0.0005712795229992073,meanmax,none,0.034362807614071275,COMPLETE
40,0.3077691152275796,2026-08-14 22:11:06.025770,2026-08-14 22:11:09.187258,0 days 00:00:03.161488,512,True,none,val_loss,0.367429261180431,robust,1.2670724424773736,0.5,107,,1,10,focal,0.0004835024499279517,meanmax,none,0.03322542500259099,PRUNED
41,0.32154891115534107,2026-08-14 22:11:09.193511,2026-08-14 22:11:45.451258,0 days 00:00:36.257747,128,True,balanced,val_loss,0.523031933097114,minmax,,0.5,23,0.16319631849002303,1,10,ce,0.0006127586003962894,attn,none,0.052079238732911606,COMPLETE
42,0.32733254213999174,2026-08-14 22:11:45.459040,2026-08-14 22:12:04.717450,0 days 00:00:19.258410,128,True,balanced,val_loss,0.28531556271353337,standard,1.58799825949997,0.5,62,,1,10,focal,0.0003303799257845519,last,none,0.011753580466203645,COMPLETE
43,0.31258312092055124,2026-08-14 22:12:04.724201,2026-08-14 22:12:14.277295,0 days 00:00:09.553094,128,True,sqrt,val_loss,0.5163720449910453,robust,1.7273771896933523,0.5,29,,1,10,focal,0.0008228481198628882,attn,plateau,0.008064887785935039,PRUNED
44,0.35798755773414437,2026-08-14 22:12:14.283776,2026-08-14 22:12:24.816799,0 days 00:00:10.533023,256,True,balanced,val_loss,0.46528233804576796,robust,1.4613200931619594,0.5,52,,1,10,focal,0.0016478644336222357,meanmax,none,0.008600168150919156,COMPLETE
45,0.34129416161411,2026-08-14 22:12:24.823729,2026-08-14 22:12:37.017463,0 days 00:00:12.193734,256,True,balanced,val_loss,0.4304409307864159,robust,1.307203842045747,5.0,106,,2,10,focal,0.0008869887762290434,meanmax,plateau,0.005783301193685967,COMPLETE
46,0.33847308229145245,2026-08-14 22:12:37.024389,2026-08-14 22:12:52.452005,0 days 00:00:15.427616,256,True,balanced,val_loss,0.3208145018046743,minmax,1.8346732361898366,1.0,33,,1,10,focal,0.001926908073264182,meanmax,none,0.005532119339597552,COMPLETE
47,0.35062922889208437,2026-08-14 22:12:52.459520,2026-08-14 22:13:45.767624,0 days 00:00:53.308104,64,True,balanced,val_loss,0.18649233067183152,robust,1.3284579086567527,0.5,42,,3,10,focal,5.9515458133455036e-05,attn,plateau,0.0022530913039846842,COMPLETE
48,0.3440495769830226,2026-08-14 22:13:45.776347,2026-08-14 22:14:53.294482,0 days 00:01:07.518135,64,True,balanced,val_loss,0.07446802265543946,robust,1.2375035315350125,0.5,16,,3,10,focal,7.076831492350222e-05,attn,plateau,0.0023859410710889216,COMPLETE
49,0.29923313116061845,2026-08-14 22:14:53.302059,2026-08-14 22:15:04.693076,0 days 00:00:11.391017,256,True,sqrt,val_loss,0.4174078463715707,robust,1.3028314313777465,0.5,42,,1,60,focal,0.002099109832535346,meanmax,none,0.015246340801840178,COMPLETE
50,0.3172702724921079,2026-08-14 22:15:04.699740,2026-08-14 22:15:11.281792,0 days 00:00:06.582052,256,True,balanced,val_loss,0.5201714517397067,robust,1.6884542308678228,0.5,26,,1,10,focal,0.0005183306315981847,meanmax,plateau,0.023058161699861485,PRUNED
51,0.3374381491790197,2026-08-14 22:15:11.288510,2026-08-14 22:15:57.792209,0 days 00:00:46.503699,64,True,balanced,val_f1,0.041042041036936414,robust,1.122669339531899,0.5,17,,3,10,focal,2.6517022092379487e-05,attn,plateau,0.0016753797389222546,COMPLETE
52,0.2528033142187152,2026-08-14 22:15:57.799687,2026-08-14 22:16:08.138497,0 days 00:00:10.338810,64,True,balanced,val_loss,0.29284301515067984,robust,1.1429796058210242,0.5,23,,3,60,focal,8.450727261333301e-05,attn,plateau,0.0008201498721193069,PRUNED
53,0.3580019221110713,2026-08-14 22:16:08.145069,2026-08-14 22:16:25.627059,0 days 00:00:17.481990,256,True,balanced,val_loss,0.05615502678745947,robust,1.2572184973692249,0.5,19,,3,40,focal,0.00012419868498405242,last,plateau,0.0018918960737621178,COMPLETE
54,0.33653748664850436,2026-08-14 22:16:25.634135,2026-08-14 22:16:35.287857,0 days 00:00:09.653722,512,True,balanced,val_loss,0.09656876356364243,robust,1.4159719133430622,0.5,17,,3,40,focal,0.00023534493827392808,last,plateau,0.008046327250601138,COMPLETE
55,0.30295224075873706,2026-08-14 22:16:35.297442,2026-08-14 22:17:33.374428,0 days 00:00:58.076986,64,True,none,val_loss,0.31373923328319675,standard,1.4502019195638332,0.5,47,,3,10,focal,2.7914111081667204e-05,attn,cosine,0.007301120070188009,COMPLETE
56,0.31493259428839177,2026-08-14 22:17:33.381634,2026-08-14 22:17:59.761666,0 days 00:00:26.380032,256,True,balanced,val_f1_ma3,0.5010017381128928,robust,,0.5,121,0.18441429730732825,1,10,ce,0.002952419789271364,meanmax,none,0.027486404898242243,COMPLETE
57,0.29868662173544913,2026-08-14 22:17:59.768637,2026-08-14 22:18:09.461101,0 days 00:00:09.692464,256,False,balanced,val_loss,0.09073994139538595,robust,1.1229192222012947,0.5,29,,3,40,focal,3.4022108286819765e-05,last,plateau,0.00045948064405550474,PRUNED
58,0.36024363041685226,2026-08-14 22:18:09.469058,2026-08-14 22:18:44.062128,0 days 00:00:34.593070,64,False,balanced,val_loss,0.3225089630958836,robust,1.749535882812712,0.5,116,,3,10,focal,8.816188174001814e-05,attn,plateau,0.0008141054081609036,COMPLETE
59,0.31201786693974537,2026-08-14 22:18:44.071014,2026-08-14 22:19:13.604383,0 days 00:00:29.533369,64,False,balanced,val_loss,0.25576599182543164,robust,2.036875694420663,0.5,115,,3,10,focal,1.4720051768484674e-05,attn,plateau,0.009112364807893895,PRUNED
60,0.2982952722470266,2026-08-14 22:19:13.611531,2026-08-14 22:20:48.546156,0 days 00:01:34.934625,64,False,balanced,val_f1_ma3,0.33451890876006934,robust,1.9392371372487822,1.0,57,,3,10,focal,0.00021497895406437365,attn,plateau,0.0012629261665424395,COMPLETE
61,0.3434451566098097,2026-08-14 22:20:48.554380,2026-08-14 22:21:41.903103,0 days 00:00:53.348723,64,True,balanced,val_loss,0.5593655877159298,robust,1.708672988729374,5.0,51,,1,10,focal,8.3841606805134e-05,meanmax,none,0.08442973755133164,COMPLETE
62,0.3177480927001655,2026-08-14 22:21:41.911844,2026-08-14 22:21:49.805410,0 days 00:00:07.893566,256,True,sqrt,val_loss,0.17669111371040272,robust,1.593297525005587,0.5,22,,3,60,focal,3.668339626588978e-05,last,plateau,0.0017156228500038006,PRUNED
63,0.29840728855510246,2026-08-14 22:21:49.824735,2026-08-14 22:22:26.352649,0 days 00:00:36.527914,64,True,balanced,val_loss,0.47729615274045795,robust,1.5185177148159335,0.5,55,,1,60,focal,0.0005532448606691407,meanmax,cosine,0.001447147532451247,COMPLETE
64,0.33717613858731244,2026-08-14 22:22:26.361668,2026-08-14 22:22:55.761173,0 days 00:00:29.399505,64,True,balanced,val_loss,0.4221607649302354,standard,,0.5,43,0.055751339895235,1,10,ce,0.0008089962819269248,meanmax,none,0.013273703262805334,COMPLETE
65,0.3048392660706099,2026-08-14 22:22:55.769807,2026-08-14 22:23:03.635436,0 days 00:00:07.865629,64,False,none,val_loss,0.2774277684321719,robust,1.073340416189297,0.5,94,,3,40,focal,0.00029807547049258377,attn,plateau,0.0010956204863813528,PRUNED
66,0.31567265313214243,2026-08-14 22:23:03.641758,2026-08-14 22:23:22.280523,0 days 00:00:18.638765,128,False,balanced,val_f1,0.5310177476969588,robust,1.6377455906736154,0.5,51,,1,10,focal,0.0016370554366701476,meanmax,none,0.037981543487915874,COMPLETE
67,0.3649009372416414,2026-08-14 22:23:22.287949,2026-08-14 22:23:57.495250,0 days 00:00:35.207301,64,False,balanced,val_loss,0.43076719561956667,robust,1.4326011305186719,5.0,118,,2,10,focal,0.00015934275835801813,attn,plateau,0.0007777647470212787,COMPLETE
68,0.31436060778256364,2026-08-14 22:23:57.503376,2026-08-14 22:24:17.695314,0 days 00:00:20.191938,64,False,balanced,val_loss,0.4727196917502629,robust,,0.5,76,0.13604639825737655,3,10,ce,0.00023206234793017146,attn,cosine,0.0003414225516172076,PRUNED
69,0.25445601366725384,2026-08-14 22:24:17.702896,2026-08-14 22:24:19.658793,0 days 00:00:01.955897,512,False,none,val_loss,0.4279031888752224,robust,1.0394875803819523,5.0,151,,2,10,focal,0.0002901008423844347,attn,plateau,0.009527165719573558,PRUNED
70,0.2849092155256488,2026-08-14 22:24:19.665050,2026-08-14 22:24:51.261576,0 days 00:00:31.596526,64,False,balanced,val_f1,0.5016813703018421,robust,1.6803098507088217,5.0,77,,2,60,focal,0.00024670799430566117,attn,plateau,0.05105986032068624,COMPLETE
71,0.30172826541763254,2026-08-14 22:24:51.269528,2026-08-14 22:25:25.526157,0 days 00:00:34.256629,64,False,balanced,val_loss,0.5155241104245132,minmax,1.3883794826304394,0.5,16,,2,60,focal,0.0003593264873180915,attn,none,0.02732581772045962,PRUNED
72,0.31103049501701346,2026-08-14 22:25:25.533126,2026-08-14 22:26:17.920463,0 days 00:00:52.387337,64,False,balanced,val_loss,0.4538816915958085,robust,1.4072741910412523,5.0,147,,2,10,focal,1.602206408836324e-05,attn,plateau,3.590368649626325e-05,COMPLETE
73,0.3277310870787526,2026-08-14 22:26:17.926587,2026-08-14 22:26:27.052752,0 days 00:00:09.126165,256,True,balanced,val_loss,0.13294218920167555,robust,1.5792677577844365,1.0,25,,3,40,focal,4.737378121109068e-05,last,none,0.008638896607635211,PRUNED
74,0.3545306399049167,2026-08-14 22:26:27.059810,2026-08-14 22:27:04.333779,0 days 00:00:37.273969,64,False,balanced,val_loss,0.5808952600022732,robust,1.405508377703987,5.0,78,,1,10,focal,0.0010954973444029662,attn,plateau,0.0020050108096525423,COMPLETE
75,0.30011006766905257,2026-08-14 22:27:04.340552,2026-08-14 22:28:29.020644,0 days 00:01:24.680092,64,False,balanced,val_f1_ma3,0.4866433244524817,robust,1.1728631649403458,5.0,97,,1,10,focal,0.0010817318638088097,attn,plateau,0.0015701742709538164,COMPLETE
76,0.34261326741758447,2026-08-14 22:28:29.028877,2026-08-14 22:29:15.089598,0 days 00:00:46.060721,64,True,balanced,val_loss,0.32901255797791396,robust,1.845091428783365,5.0,82,,3,10,focal,0.0001921780259689454,attn,plateau,0.0011335562954346377,COMPLETE
77,0.28343355762298017,2026-08-14 22:29:15.096500,2026-08-14 22:29:17.175478,0 days 00:00:02.078978,512,False,balanced,val_loss,0.4693908767174194,robust,1.427944756421169,0.5,26,,1,40,focal,0.0002018692481002016,attn,cosine,0.004704519959290994,PRUNED
78,0.2592857500334391,2026-08-14 22:29:17.183396,2026-08-14 22:29:21.730984,0 days 00:00:04.547588,128,True,balanced,val_loss,0.2018222706320446,minmax,1.4217400051532243,1.0,64,,2,10,focal,5.027557931238707e-05,attn,plateau,0.002044056822383268,PRUNED
79,0.2985705684208694,2026-08-14 22:29:21.738070,2026-08-14 22:29:28.814948,0 days 00:00:07.076878,64,False,sqrt,val_loss,0.42723729712666497,robust,0.8088141785330616,0.5,90,,2,10,focal,0.00018890442482108195,attn,plateau,0.00024179495728135774,PRUNED
